{
  "schema_version": 5,
  "authority_path": "source/formal-logic-reference.tex",
  "authority_sha256": "0509750c13b88a4e18914bd52bde171c725cba14221cbfc2227d7693a2b421cc",
  "records": [
    {
      "unit_ordinal": 1010,
      "unit_kind": "chapter",
      "unit_title": "Binding and Precedence",
      "unit_source_label": "ch:binding-precedence",
      "source_start": 15207,
      "source_end": 15207,
      "source_sha256": "6d889d04ed8e0396eb7374ccf07f5c7c32c7b1f405075ec7d9848886eca4ffbe",
      "restoration_record_path": "spec/provenance/SRC-15207-15239.json",
      "restoration_record_sha256": "7652ce6dc0e665c14d2dacead7edd39d7649d62a7c2607a2b1b6fb200abc66ab",
      "restoration_provenance_id": "SRC-15207-15239",
      "authority_path": "source/formal-logic-reference.tex",
      "authority_sha256": "0509750c13b88a4e18914bd52bde171c725cba14221cbfc2227d7693a2b421cc",
      "authority_edition_status": "identified",
      "authority_edition_value": "Version 1.0",
      "presentation_identity_status": "identified",
      "presentation_identity_value": "SRC-15207-15239/unit-01010",
      "presentation_identity_description": "chapter 'Binding and Precedence' at authority lines 15207--15207, within the exact SRC-15207-15239 restoration interval.",
      "provenance_disposition": "open/missing",
      "handbook_destination_status": "identified",
      "handbook_destination": "handbook/restoration/inherited-15207-15239.tex",
      "handbook_destination_sha256": "5f167b81d41e56030d833194ebba03b03d8aa8efe13a8d27c0020845698e8881",
      "stable_labels": [
        "ch:binding-precedence",
        "app:precedence"
      ],
      "audit_result": "pending/unclassified",
      "layout_changes": [],
      "defect_exclusions": [],
      "variant_links": [],
      "completeness": {
        "notation": "pending",
        "definitions": "pending",
        "rules": "pending",
        "side_conditions": "pending",
        "hypotheses": "pending",
        "statements": "pending",
        "proofs": "pending",
        "examples": "pending",
        "qualifications": "pending",
        "attribution": "pending"
      },
      "verification": {
        "source_fidelity_ai": "pending",
        "topic_specialist_ai": "pending",
        "adversarial_publication_ai": "pending",
        "static": "pass",
        "build": "pending",
        "visual": "pending"
      },
      "verification_evidence": [
        {
          "category": "static",
          "recorded_result": "pass",
          "artifact_path": "spec/provenance/SRC-15207-15239.json",
          "sha256": "7652ce6dc0e665c14d2dacead7edd39d7649d62a7c2607a2b1b6fb200abc66ab",
          "producer_identity": "governed inherited-restoration validator",
          "recorded_scope": "SRC-15207-15239 frozen-authority identity, source-unit membership, exact artifact digest, wrapper route, destination locator, and pending-gate boundaries."
        }
      ]
    }
  ]
}
